{
  "contract": {"name": "hausman-hub-home", "version": 2},
  "generated_at": 1784280000000,
  "climate": {"fresh": true, "commands_enabled": false},
  "rooms": [
    {
      "id": "living",
      "name": "Living room",
      "temperature": 25.8,
      "humidity": 44.0,
      "target_temperature": 24.0,
      "target_humidity": null,
      "mode": "auto",
      "authority_eligible": true,
      "control": {
        "enabled": false,
        "actions": ["set_room_target", "turn_room_off"],
        "blocked_reasons": ["shadow_only"]
      },
      "devices": [
        {
          "id": "living_ac",
          "name": "Living AC",
          "kind": "air_conditioner",
          "control_scope": "canary",
          "capabilities": ["power", "target_temperature", "hvac_mode", "fan_mode"],
          "available": true,
          "state": "cool"
        }
      ]
    }
  ],
  "reconciliation": {
    "matches": true,
    "matched_device_ids": ["living_ac"],
    "missing_device_ids": [],
    "room_mismatch_device_ids": [],
    "unregistered_device_count": 0
  }
}
